Storm,Tropical cyclone,Natural,Meteorological,Typhoon Haiyan (Yolanda),,Palau,"Ngercelong, Ngaraard, Ngardmau, Koror, Airai, Aimelick, Ngatpang, Ngiwal, Melekeok, Ngchesar, Ngeramlengu areas (Palau province)",,,2013-11-07,2013-11-07,,,,,91.12079403
Storm,Extra-tropical storm,Natural,Meteorological,Storm Xaver,,Poland,"Dolnoslaskie, Kujawsko-Pomorskie, Lodzkie, Lubeiskie, Lubuskie, Malopolske, Mazowieckie, Opolskie, Podkarpackie, Podlaskie, Pomorskie, Slaskie, Swietokrzyskie, Warminsko-Mazurskie, Wielkopolskie, Zachodnio-Pomorskie provinces",,,2013-12-07,2013-12-07,4.0,,,,91.12079403
Extreme temperature,Cold wave,Natural,Meteorological,,,Poland,"Podlaskie, Warminsko-Mazurskie provinces",,,2013-03-01,2013-03-26,25.0,,,,91.12079403
Storm,Extra-tropical storm,Natural,Meteorological,Storm Dirk,,Portugal,"Lisboa, Santarém provinces",,,2013-12-24,2013-12-25,,,,,91.12079403
Wildfire,Forest fire,Natural,Climatological,,,Portugal,"Aveiro, Viseu provinces (Caramulo)",,,2013-01-01,2013-08-28,9.0,,,,91.12079403
Drought,Drought,Natural,Climatological,,Rainfall shortages,Paraguay,"Presidente Hayes, Boqueron, Alto Paraguay, San Pedro, Concepcion, Amambay, Canindeyu, Alto Parana, Itapua, Cordillera, Guaira, Neembucu, Paraguari, Caazapa, Caaguazu provinces",,,2013-09-01,2014-08-28,,75000.0,,,91.12079403
Flood,Riverine flood,Natural,Hydrological,,Torrential rains,Romania,"Galati, Braila, Tulcea provinces",,27.55,2013-09-11,2013-09-15,9.0,5400.0,,11000.0,91.12079403
Flood,Riverine flood,Natural,Hydrological,,Heavy rains,Senegal,"Fatick, Kaolack, Thies, Dakar provinces",,,2013-09-13,2013-09-13,8.0,163212.0,,,91.12079403
Flood,Riverine flood,Natural,Hydrological,,,Solomon Islands,Guadalcanal area,,,2013-08-29,2013-09-02,,10227.0,,2000.0,91.12079403
Wildfire,,Natural,Climatological,,Dry Hamatan wind,Sierra Leone,"Blama Gbani community (Bo district, Southern province); Tiama community (Moyamba district, Southern province); Bompilia community (Bonthe district, Southern province); Rogbenk community (Port Loko district, Northern); Pujehun district (Southern province)",,,2013-01-02,2013-01-28,,,,,91.12079403
Volcanic activity,Ash fall,Natural,Geophysical,Chaparrastique Volcano,,El Salvador,"Chinameca, San Joge, El Transito, San Rafael de Oriente districts (San Miguel province)",,,2013-12-29,2013-12-29,,63079.0,,,91.12079403
Flood,Riverine flood,Natural,Hydrological,,,Somalia,"Jowhar, Balcad districts (Shabelle Dhexe province)",,,2013-08-01,2013-11-28,,55000.0,,,91.12079403
Flood,Riverine flood,Natural,Hydrological,,,Slovakia,"Bratislava, Nitra, Trnava provinces",,,2013-06-03,2013-06-05,1.0,,,,91.12079403
Storm,Extra-tropical storm,Natural,Meteorological,Storm Xaver,,Sweden,"Blekinge Laen, Dalarnas Laen, Gaevleborgs Laen, Gotlands Laen, Hallands Laen, Jaemtlands Laen, Joenkoepings Laen, Kalmar Laen, Kronobergs Laen, Norrbottens Laen, Oerebro Laen, Oestergoetlands Laen, Skaane Laen, Soedermanlands Laen, Stockholms Laen, Uppsala Laen, Vaermlands Laen, Vaesterbottens Laen, Vaesternorrlands Laen, Vaestmanlands Laen, Vaestra Goetalands Laen provinces",,,2013-12-07,2013-12-07,7.0,,,,91.12079403
Flood,Riverine flood,Natural,Hydrological,,,Thailand,Mae Sot district (Tak province),,,2013-07-25,2013-07-27,,,,97000.0,91.12079403
Flood,Riverine flood,Natural,Hydrological,,Monsoonal rain,Thailand,"Ang Thong, Chachoengsao, Chainat, Chanthaburi, Chian Rai, Nahkon Nayok, Nakhon Ratchasima, Nakhon Sawan, Pathum Thani, Prachinburi, Phangnga, Phetchaburi, Phichit, Phitsanulok, Phra Nakhon Si Ayudhya, Prachuap Khilikhan, Sa Kaeo, Sakon Nakhon, Si Saket, Surin, Tak, Ubon Ratchathani provinces",,101.69,2013-09-30,2013-10-14,61.0,3500000.0,,482000.0,91.12079403
Extreme temperature,Severe winter conditions,Natural,Meteorological,,,Tajikistan,"Alichur, Bulunkul, Karakul, Rangkul, Tokhtamish, Kuhnakurgan, Modiyon, Chechtube, Chichekdeh, Shaimok, Bashgunbez villages (Murgabskiy district, Badakhshoni Kuni province)",,,2013-01-01,2013-02-28,,2500.0,,,91.12079403
Landslide,Landslide,Natural,Hydrological,,Heavy rains,Turkey,Sirnak province,,,2013-01-28,2013-01-28,7.0,,,,91.12079403
Storm,Tropical cyclone,Natural,Meteorological,Typhoon Soulik,,Taiwan (Province of China),"Bailan village (Xinzhu Xian area, Taiwan Sheng province)",,,2013-07-14,2013-07-14,3.0,,,43500.0,91.12079403
Storm,Tropical cyclone,Natural,Meteorological,Typhoon Trami (Maring),,Taiwan (Province of China),Taiwan Sheng province,,,2013-08-22,2013-08-22,2.0,,,12000.0,91.12079403
Storm,Tropical cyclone,Natural,Meteorological,Typhoon Usagi (Odette),,Taiwan (Province of China),Taiwan Sheng province,,,2013-09-22,2013-09-22,,,,6100.0,91.12079403
Flood,Riverine flood,Natural,Hydrological,,Torrential rains,Uganda,Kasese province,,,2013-05-01,2013-05-05,13.0,25445.0,,3100.0,91.12079403
Flood,Riverine flood,Natural,Hydrological,,,Ukraine,Odes'ka province,,,2013-09-14,2013-09-15,2.0,265.0,,21000.0,91.12079403
Storm,Convective storm,Natural,Meteorological,,,United States of America (the),"Illinois, Indiana, Iowa, Kansas, Michigan, Minnesota, Missouri, Nebraska, North Dakota, Ohio, South Dakota, Wisconsin, New York, New Jersey, Pennsylvania, Maine, New Hampshire, Vermont, Massachusetts, Rhode Island, Connecticut, Alabama, Arkansas, Delaware, Florida, Georgia, Kentucky, Louisiana, Maryland, Mississippi, North Carolina, South Carolina, Tennessee, Virginia, West Virginia provinces",,,2013-06-12,2013-06-13,4.0,,,900000.0,91.12079403
Storm,Convective storm,Natural,Meteorological,,,United States of America (the),"Alabama, Arkansas, Delaware, Florida, Georgia, Kentucky, Louisiana, Maryland, Mississippi, North Carolina, South Carolina, Tennessee, Virginia, West Virginia, Illinois, Indiana, Iowa, Kansas, Michigan, Minnesota, Missouri, Nebraska, North Dakota, Ohio, South Dakota, Wisconsin, Colorado, Kansas, Montana, New Mexico, Oklahoma, Texas, Wyoming provinces",,,2013-01-29,2013-01-30,3.0,1089.0,,300000.0,91.12079403
Storm,Convective storm,Natural,Meteorological,,,United States of America (the),"Colorado, Kansas, Montana, Nebraska, New Mexico, North Dakota, Oklahoma, South Dakota, Texas, Wyoming, Illinois, Indiana, Iowa, Kansas, Michigan, Minnesota, Missouri, Nebraska, North Dakota, Ohio, South Dakota, Wisconsin, Maine, New Hampshire, Vermont, Massachusetts, Rhode Island, Connecticut, New York, New Jersey, Pennsylvania provinces",,,2013-05-26,2013-06-06,27.0,170000.0,,2100000.0,91.12079403
Storm,Convective storm,Natural,Meteorological,,,United States of America (the),"South Dakota, North Dakota, Nebraska, Minnesota, Alabama, Illinois, Indiana, Iowa, Kansas, Michigan, Minnesota, Missouri, Nebraska, North Dakota, Ohio, South Dakota, Wisconsin, Alabama, Arkansas, Delaware, Florida, Georgia, Kentucky, Louisiana, Maryland, Mississippi, North Carolina, South Carolina, Tennessee, Virginia, West Virginia provinces",,,2013-02-09,2013-02-11,1.0,4800.0,,100000.0,91.12079403
Storm,Convective storm,Natural,Meteorological,Cleon and Dion,,United States of America (the),"Alabama, Arkansas, Connecticut, Delaware, Florida, Georgia, Kentucky, Louisiana, Maine, Maryland, Massachusetts, Mississippi, New Hampshire, New Jersey, New York, North Carolina, Oklahoma, Pennsylvania, Rhode Island, South Carolina, Tennessee, Texas, Vermont, Virginia, West Virginia provinces",,,2013-12-01,2013-12-09,20.0,,,100000.0,91.12079403
Extreme temperature,Severe winter conditions,Natural,Meteorological,,,United States of America (the),"Michigan, Ohio, New York, Vermont, Maine, Kansas, Iowa, Texas, Wisconsin, Illinois, Minnesota, Arkansas, Louisiana, Mississippi, Kentucky provinces",,,2013-12-19,2013-12-22,19.0,,,200000.0,91.12079403
Storm,Convective storm,Natural,Meteorological,,,United States of America (the),"California, Colorado, Kansas, Montana, Nebraska, New Mexico, North Dakota, Oklahoma, South Dakota, Texas, Wyoming, Illinois, Indiana, Iowa, Kansas, Michigan, Minnesota, Missouri, Nebraska, North Dakota, Ohio, South Dakota, Wisconsin, Alabama, Arkansas, Delaware, Florida, Georgia, Kentucky, Louisiana, Maryland, Mississippi, North Carolina, South Carolina, Tennessee, Virginia, West Virginia provinces",,,2013-04-07,2013-04-11,4.0,,,1600000.0,91.12079403
Storm,Convective storm,Natural,Meteorological,,,United States of America (the),"Louisiana, South Carolina, Mississippi provinces",,,2013-03-18,2013-03-19,2.0,,,2200000.0,91.12079403
Flood,Riverine flood,Natural,Hydrological,,Slow moving storm system,United States of America (the),"Cleveland, Lincoln, Catawba districts (North Carolina province), Pennsylvania province",,,2013-07-27,2013-07-28,2.0,1425.0,,25000.0,91.12079403
Wildfire,Forest fire,Natural,Climatological,,"Hot temperatures, gusty winds, dry forest conditions",United States of America (the),Los Angeles district (California province),,,2013-05-30,2013-06-08,,12.0,,21400.0,91.12079403
Wildfire,Forest fire,Natural,Climatological,,,United States of America (the),"Black Forest area (El Paso district, Colorado province)",,,2013-06-06,2013-06-20,2.0,84.0,,500000.0,91.12079403
Wildfire,Forest fire,Natural,Climatological,,,United States of America (the),"Yarnell area (Yavapai district, Arizona province)",,,2013-06-28,2013-07-12,19.0,,,2000.0,91.12079403
Wildfire,,Natural,Climatological,,,United States of America (the),"Yosemite valley (Mariposa district, California province)",,,2013-08-03,2013-09-01,,,,175000.0,91.12079403
Wildfire,,Natural,Climatological,,,United States of America (the),Shasta district (California province),,,2013-09-09,2013-09-15,1.0,15.0,,10000.0,91.12079403
Flood,Riverine flood,Natural,Hydrological,,,Viet Nam,"Lao Cai, Son La, Quang Ninh, Tuyen Quang provinces",,,2013-07-28,2013-07-30,5.0,5000.0,,6500.0,91.12079403
Flood,Riverine flood,Natural,Hydrological,,Mosoonal rain and typhoon Usagi,Viet Nam,"An Giang, Ba Ria-Vung Tau, Bac Lieu, Ben Tre, Binh Dinh, Binh Duong, Binh Phuoc, Binh Thuan, Ca Mau, Can Tho City, Da Nang City, Dak Lak, Dak Nong, Dong Nai, Dong Thap, Gia Lai, Ha Tinh, Hau Giang, Ho Chi Minh City, Khanh Hoa, Kien Giang, Kon Tum, Lam Dong, Long An, Ninh Thuan, Phu Yen, Quang Binh, Quang Nam, Quang Ngai, Quang Tri, Soc Trang, Tay Ninh, Thua Thien - Hue, Tien Giang, Tra Vinh, Vinh Long provinces",,,2013-09-24,2013-09-24,30.0,,,,91.12079403
Flood,Riverine flood,Natural,Hydrological,,Tropical Depression 18,Viet Nam,"Dak Lak, Quang Tri, Quang Ngai, Quang Nam, Kon Tum provinces",,,2013-09-16,2013-09-18,7.0,25000.0,,,91.12079403
Storm,Tropical cyclone,Natural,Meteorological,Tropical storm Jebi,,Viet Nam,"Bac Giang, Bac Kan, Bac Ninh, Cao Bang, Dien Bien, Ha Giang, Ha Nam, Ha Noi City, Ha Tay, Hai Duong, Hai Phong City, Hoa Binh, Hung Yen, Lai Chau, Lang Son, Lao Cai, Nam Dinh, Ninh Binh, Phu Tho, Quang Ninh, Son La, Thai Binh, Thai Nguyen, Thanh Hoa, Tuyen Quang, Vinh Phuc, Yen Bai provinces",,,2013-08-02,2013-08-03,7.0,5000.0,,1000.0,91.12079403
Storm,Tropical cyclone,Natural,Meteorological,Typhoon Wutip,,Viet Nam,"Binh Dinh, Quang Binh, Quang Nam, Quang Ngai, Ha Tinh, Quang Tri, Thua Thien - Hue, Khanh Hoa, Nghe An, Da Nang City, Phu Yen, Thanh Hoa provinces",,,2013-09-30,2013-10-15,31.0,1835255.0,,663230.0,91.12079403
Storm,Tropical cyclone,Natural,Meteorological,Tropical storm Nari (SAnti),,Viet Nam,"Da Nang City, Quang Nam, Thua Thien - Hue, Quang Ngai provinces",,,2013-10-10,2013-10-15,20.0,109600.0,,76000.0,91.12079403
Storm,Tropical cyclone,Natural,Meteorological,Typhoon Haiyan (Yolanda),,Viet Nam,"Quang Ninh, Hai Phong City, Bac Giang, Quang Ngai, Thanh Hoa, Nghe An, Ha Tinh, Quang Tri, Thua Thien - Hue, Da Nang City, Quang Nam provinces",,,2013-11-11,2013-11-11,16.0,12630.0,,734000.0,91.12079403
Flood,Riverine flood,Natural,Hydrological,,Heavy rains,Zambia,"Nagoma, Kabulwebulwe towns (Mumbwa district, Central province)",,,2013-01-01,2013-01-28,,1800.0,,,91.12079403
Flood,Flash flood,Natural,Hydrological,,Heavy rains,Serbia,"Gjakova, Istog, Peja, Klina municipalities (Pecki province), Skenderaj, Mitrove municipalities (Kosovsko-mitrovatski province), Kramenice municipality (Kosovsko-pomoravski province)",,,2013-03-14,2013-03-14,,2670.0,,,91.12079403
Flood,Riverine flood,Natural,Hydrological,,Heavy rains,Serbia,"Bujanovac, Vranje, Trgoviste municipalities (Pcinjski province)",,,2013-02-24,2013-02-26,,330.0,,,91.12079403
Flood,Riverine flood,Natural,Hydrological,,Heavy rains,South Sudan,"Northern Bahr El Ghazal, Western Bahr El Ghazal, Warab provinces",,,2013-10-23,2013-10-23,1.0,156000.0,,,91.12079403
Flood,Riverine flood,Natural,Hydrological,,Heavy rains,South Sudan,"Northern Bahr El Ghazal, Warab, Upper Nile, Western Bahr El Ghazal provinces",,,2013-08-01,2013-09-28,98.0,425000.0,,,91.12079403
Storm,Tropical cyclone,Natural,Meteorological,Tropical Depression Agaton ( (Lingling),,Philippines (the),"North Cotabato, South Cotabato districts (Region XII (Soccsksargen) province), Autonomous region in Muslim Mindanao (ARMM), Region X (Northern Mindanao), Region XI (Davao Region), Region XIII (Caraga) provinces",,,2014-01-19,2014-01-20,79.0,1148621.0,,12591.0,92.59898057
Storm,Tropical cyclone,Natural,Meteorological,Topical storm Basyang (Kajiki),,Philippines (the),"Antique, Negros Occidental districts (Region VI (Western Visayas) province), Cebu (Region VII (Central Visayas) province), Biliran, Leyte, Southern Leyte districts (Region VIII (Eastern Visayas) province), Agusan del Norte, Dinagat, Surigao del Norte districts (Region XIII (Caraga) province)",,,2014-01-31,2014-02-01,6.0,47740.0,,3200.0,92.59898057
Flood,Riverine flood,Natural,Hydrological,,Torrential rains,Bulgaria,"Varna, Dobrich, Velkiko Tarnovo, Burgas, Montana, Kustendil, Plovdiv, Haskovo, Jambol, Sofia, Sofia-city provinces",,,2014-06-19,2014-06-25,15.0,,,377000.0,92.59898057
Storm,Convective storm,Natural,Meteorological,,,United States of America (the),"Colorado, Kansas, Montana, Nebraska, New Mexico, North Dakota, Oklahoma, South Dakota, Texas, Wyoming, Mississippi, Alabama, Arkansas, Delaware, Florida, Georgia, Kentucky, Louisiana, Maryland, Mississippi, North Carolina, South Carolina, Tennessee, Virginia, West Virginia, Illinois, Indiana, Iowa, Kansas, Michigan, Minnesota, Missouri, Nebraska, North Dakota, Ohio, South Dakota, Wisconsin, Florida, Alabama, New York, New Jersey, Pennsylvania provinces",,,2014-04-27,2014-05-01,40.0,,,2000000.0,92.59898057
Flood,Flash flood,Natural,Hydrological,,Heavy rain,Afghanistan,Guzargah-e-Nur district (Baghlan province),,,2014-06-03,2014-06-10,81.0,,,3000.0,92.59898057
Flood,Riverine flood,Natural,Hydrological,,Heavy rains,Peru,"Madre de Dios, Cusco, Puno, Apurimac, Pasco provinces",,,2014-01-24,2014-01-27,,6300.0,,,92.59898057
Flood,Riverine flood,Natural,Hydrological,,Heavy rains and strong winds,Seychelles,"Baie Ste Anne, Marie Jeanne Estate areas (Praslin province), La Passe area (La Digue province), Belombre province",,,2014-01-24,2014-01-24,,4435.0,,,92.59898057
Flood,Flash flood,Natural,Hydrological,,Heavy rains,Tajikistan,"Sarichashma village (Shurabad district, Khatlon province), Kulob city (Kulyab district, Khatlon province) Voseysky, Moskovskiy districts (Khatlon province)",,,2014-04-22,2014-04-30,20.0,7400.0,,2000.0,92.59898057
Flood,Flash flood,Natural,Hydrological,,Heavy rrains,Zimbabwe,"Domboshawa area (Shamva district, Mashonaland Central province), Chiredzi, Gutu, Chivi, Masvingo, Mwenezi districts (Masvingo province), Tsholotsho, Binga districts (Matabeleland North province), Gokwe South district (Midlands province), Makonde district (Mashonaland West province), Bulawayo district (Bulawayo province), Harare district (Harare province), Mangwe, Gwanda districts (Matabeleland South province)",,,2014-01-20,2014-02-10,3.0,1000.0,,20000.0,92.59898057
Flood,Riverine flood,Natural,Hydrological,,Heavy rains,Serbia,"Ljig, Valjevo municipalities (Kolubarski province), Krupanj, Mali Zvornik, Loznica, Sabac, Ljubovija municipalities (Macvanski province), Gornji Milanovac, Cacak municipalities (Moravicki province), Grocka, Lazarevac, Obrenovac, Belgrade municipalities (Grad Beograd province), Bajina Basta municipality (Zlatiborski province)",,,2014-05-13,2014-05-20,51.0,49600.0,,2048262.0,92.59898057
Flood,Riverine flood,Natural,Hydrological,,Heavy rains,Bosnia and Herzegovina,"Sanski Most municipality (Unsko-sanski district), Srpski Sanski Most municipality (Sanski Most discrict), Banja Luka municipality (Banja Luka district), Celinac municipality (Celinac district), Kotor Varos municipality (Kotor Varos district), Zenica, Zepce, Maglaj, Vares, Kakanj, Visoko, Olovo, Doboj-Jug, Breza, Doboj-Jug municipalities (Zenicko-Dobojski district), Tuzla, Celic, Srebrenik, Gracanica, Gradacac, Kladanj, Lukavac, Sapna, Brcko, Doboj-Istok municipalities (Tuzlansko-podrinjski, Tuzla, Kladanj, Gracanica districts), Bijeljina municipality (Bijeljina disctict), Brcko municipality (Brcko district),Petrovo municipality (Maglaj, Gracanica districts), Doboj municipality (Doboj, Tesanj districts), Modrica municipality (Modrica district), Samac municipality (Bosanski Samac district), Domaljevac-Samac municipality (Posavski district), Zvornik municipality (Zvornik district), Bratunac municipality (Bratunac district), Srebrenica municipality (Srebrenica district), Stari Grad Sarajevo municipality (Sarajevo district), Sekovici municipality (Sekovici district)",,,2014-05-13,2014-05-20,25.0,1000000.0,,436580.0,92.59898057
Flood,Riverine flood,Natural,Hydrological,,Heavy rains,Bangladesh,"Lalmonirhat, Kurigram, Nilphamari, Rangpur, Gaibandha districts (Rangpur province), Bogra, Sirajganj districts (Rajshahi province), Sunamganj, Sylhet districts (Sylhet province), Sherpur, Netrakona, Munshiganj, Jamalpur, Tangail, Faridpur, Manikganj, Rajbari districts (Dhaka province), Bhola, Patuakhali, Barguna districts (Barisal province), Feni, Chittagong districts (Chittagong province)",,,2014-08-11,2014-09-10,59.0,2800000.0,,160000.0,92.59898057
Flood,Riverine flood,Natural,Hydrological,,Heavy rains,Bulgaria,"Mizija, Borovan, Bjala Slatina districts (Vratca province) ; Sofia, Plovdic, Montana provinces",,,2014-07-31,2014-08-02,2.0,7247.0,,,92.59898057
Storm,Convective storm,Natural,Meteorological,,,United States of America (the),"Illinois, Indiana, Iowa, Kansas, Michigan, Minnesota, Missouri, Nebraska, North Dakota, Ohio, South Dakota, Wisconsin, Colorado, Kansas, Montana, Nebraska, New Mexico, North Dakota, Oklahoma, South Dakota, Texas, Wyoming, Maine, New Hampshire, Vermont, Massachusetts, Rhode Island, Connecticut, New York, New Jersey, Pennsylvania provinces",,,2014-02-02,2014-02-06,9.0,,,250000.0,92.59898057
Storm,Convective storm,Natural,Meteorological,,,United States of America (the),"District of Columbia, New York, Georgia, South Carolina, North Carolina, Pennsylvania provinces",,,2014-02-11,2014-02-14,25.0,,,750000.0,92.59898057
Extreme temperature,Heat wave,Natural,Meteorological,,,Pakistan,"Mithi, Chachro, Dahli, Diplo, Islamkot, Nagarparkar regions (Tharparkar district, Sindh province)",,,2014-01-01,2014-04-30,139.0,,,18000.0,92.59898057
Storm,Tropical cyclone,Natural,Meteorological,Tropical cylone Lusi,,Vanuatu,"Western Pentecost, East Ambae, Maewo areas (Penama province), Western Ambrym area (Malampa province), South Santo area (Sanma province), Gaua, Vanua Lava areas (Torba province), Shepherd area (Shefa province)",,,2014-03-09,2014-03-12,12.0,20000.0,,2000.0,92.59898057
Storm,Convective storm,Natural,Meteorological,,,Morocco,"Casablanca district (Grand Casablanca province), Rabat district (Rabat-Salé-Zemmour province)",,,2014-01-07,2014-01-07,,,,,92.59898057
Storm,Tropical cyclone,Natural,Meteorological,Cyclone Helen,,Madagascar,"Betsiboka, Boeny, Diana, Melaky, Sofia provinces",,,2014-03-29,2014-04-01,17.0,,,,92.59898057
Landslide,Avalanche,Natural,Hydrological,,,Nepal,Sagarmatha district (Eastern province),,,2014-04-18,2014-04-18,16.0,,,,92.59898057
Extreme temperature,Cold wave,Natural,Meteorological,,,Poland,"Dolnoslaskie, Kujawsko-Pomorskie, Lodzkie, Lubeiskie, Lubuskie, Malopolske, Mazowieckie, Opolskie, Podkarpackie, Podlaskie, Pomorskie, Slaskie, Swietokrzyskie, Warminsko-Mazurskie, Wielkopolskie, Zachodnio-Pomorskie provinces",,,2014-01-23,2014-01-27,78.0,,,,92.59898057
Storm,Convective storm,Natural,Meteorological,,,Portugal,Porto province,,,2014-01-04,2014-01-07,,50.0,,,92.59898057
Storm,Extra-tropical storm,Natural,Meteorological,Ulla,,Portugal,Ilha Da Madeira province,,,2014-02-15,2014-02-16,1.0,,,,92.59898057
Storm,Tropical cyclone,Natural,Meteorological,Cyclone Beisja,,Réunion,"Arrondissement du vent, Arrondissement sous le vent provinces",,,2014-01-02,2014-01-02,1.0,250.0,,85000.0,92.59898057
Extreme temperature,Cold wave,Natural,Meteorological,,,Romania,Bucarest province,,,2014-01-26,2014-01-31,13.0,,,,92.59898057
Extreme temperature,Severe winter conditions,Natural,Meteorological,,,Slovenia,Notranjsko-kraska province,,,2014-01-31,2014-02-02,1.0,50000.0,,,92.59898057
Extreme temperature,Cold wave,Natural,Meteorological,,,Thailand,"Loei, Tak, Nan, Chiang Mai, Nakhon Phanom, Nong Bua Lamphu provinces",,,2014-01-01,2014-01-28,63.0,1000000.0,,,92.59898057
Storm,Tropical cyclone,Natural,Meteorological,Ian,,Tonga,"Mo'unga'one, Ha'ano, Foa, Lifuka, Lofanga, Uiha islands (Ha'apai island group, Tonga province), Vava'u island group (Tonga province)",,,2014-01-06,2014-01-11,1.0,4000.0,,31000.0,92.59898057
Flood,Flash flood,Natural,Hydrological,,Heavy rains,"Tanzania, United Republic of","Kilosa, Mvomero, Gairo, Morogoro, Morogoro Urban districts (Morogoro province)",,,2014-01-22,2014-01-23,3.0,20000.0,,2000.0,92.59898057
Storm,Convective storm,Natural,Meteorological,,,United States of America (the),"Illinois, Indiana, Iowa, Kansas, Michigan, Minnesota, Missouri, Nebraska, North Dakota, Ohio, South Dakota, Wisconsin, Maine, Massachusetts, New Hampshire, Vermont, Rhode Island, Connecticut, New York, New Jersey, Pennsylvania, Maryland provinces",,,2014-01-01,2014-01-05,16.0,,,210000.0,92.59898057
Storm,Convective storm,Natural,Meteorological,,,United States of America (the),"Georgia, Alabama, Mississippi, Louisiana, North Carolina, South Carolina provinces",,,2014-01-26,2014-01-29,13.0,,,250000.0,92.59898057
Storm,Convective storm,Natural,Meteorological,,,United States of America (the),"California, Colorado, Kansas, Montana, Nebraska, New Mexico, North Dakota, Oklahoma, South Dakota, Texas, Wyoming, Illinois, Indiana, Iowa, Kansas, Michigan, Minnesota, Missouri, Nebraska, North Dakota, Ohio, South Dakota, Wisconsin, Tennessee, New York, New Jersey, Pennsylvania provinces",,,2014-02-28,2014-03-04,12.0,,,2000.0,92.59898057
Landslide,Landslide,Natural,Hydrological,,Heavy rains and small earthquake,United States of America (the),"Oso village (Snohomish district, Washington province)",,,2014-03-22,2014-03-22,43.0,,,20000.0,92.59898057
Extreme temperature,Cold wave,Natural,Meteorological,,,United States of America (the),"New York, Minnesota, Georgia, Maryland, Alaska, Alabama, Mississippi, Louisiana, North Carolina, South Carolina, Ohio, Indiana, Illinois, Pennsylvania, Michigan, New Jersey, Virginia, Kentucky, Missouri provinces",,,2014-01-05,2014-01-08,21.0,,,2500000.0,92.59898057
Drought,Drought,Natural,Climatological,,,United States of America (the),San Joaquin district (California province),,,2014-01-01,2014-12-28,,,,2200000.0,92.59898057
Landslide,Landslide,Natural,Hydrological,,Heavy rains,Congo (the Democratic Republic of the),Bukavu district (Sud-Kivu province),,,2014-01-18,2014-01-19,11.0,,,,92.59898057
Extreme temperature,Severe winter conditions,Natural,Meteorological,,,Serbia,"Backa Topola city (Severno-backi province), Zrenjanin city (Srednje-banatski province), Kikinda city (Severno-banatski province), Juzno-backi province",,,2014-01-28,2014-02-02,,3000.0,,,92.59898057
Flood,Riverine flood,Natural,Hydrological,,,Argentina,"Chaco, Formosa, Misiones, Corrientes provinces",,,2014-06-07,2014-06-30,,,,62000.0,92.59898057
Flood,,Natural,Hydrological,,Hevay rains,Argentina,"Buenos Aires D.f., Buenos Aires provinces",,,2014-10-30,2014-11-04,3.0,5203.0,,,92.59898057
Storm,Convective storm,Natural,Meteorological,,,Australia,Brisbane district (Queensland province),,,2014-11-22,2014-11-30,,52527.0,,1000000.0,92.59898057
Storm,Convective storm,Natural,Meteorological,,,Belgium,"Region de Bruxelles-Capitale, Vlaams Gewest, Region wallonne provinces",,,2014-06-08,2014-06-10,,,,,92.59898057
Storm,Convective storm,Natural,Meteorological,,,Bangladesh,Faridpur district (Dhaka province),,,2014-06-11,2014-06-11,4.0,1250.0,,,92.59898057
Flood,,Natural,Hydrological,,,Bangladesh,"Bogra, Naogaon districts (Rajshahi province), Jamalpur, Mymensing, Netrokona districts (Dhaka province), Kurigram Lalmonirhat, Gaibandha districts (Rangpur province), Brahmanbaria district (Chittagong province)",,,2014-09-01,2014-09-28,,400000.0,,,92.59898057
Storm,Convective storm,Natural,Meteorological,,,Bulgaria,Sofia-city province,,,2014-07-08,2014-07-08,1.0,,,545000.0,92.59898057
Flood,Riverine flood,Natural,Hydrological,,Severe thunderstorm and heavy rainfall,Bulgaria,"Burgas, Primorsko districts (Burgas province), Lovetch district (Lovetch province), Harmanli, Simeongrad, Dimitrovgrad districts (Haskovo province) Radnevo, Galabovo districts (Stara Zagora province), Mizija district (Vratca province)",,,2014-09-04,2014-09-06,3.0,,,10000.0,92.59898057
Flood,Flash flood,Natural,Hydrological,,,Bosnia and Herzegovina,Cazin municipality (Unsko-sanski district),,,2014-09-14,2014-09-15,,,,,92.59898057
Flood,Riverine flood,Natural,Hydrological,,Torrential rain,Bosnia and Herzegovina,"Banja Luka municipality (Banja Luka district), Tuzla municipality (Tuzla,Tuzlansko-podrinjski districts) , Bijeljina municipality (Bijeljina district), Zepce municipality (Zenicko-dobojski district)",,,2014-08-06,2014-08-06,1.0,600.0,,,92.59898057
