Storm,Tropical cyclone,Natural,Meteorological,"Tropical storm ""Alex""",,Guatemala,"Santa Lucía Utatlán district (Solola province), Suchitepéquez, San Marcos, Jutiapa provinces",14.4888568,-90.8498798,2010-06-27,2010-06-27,,2180.0,975000.0,,85.29206060000000
Drought,Drought,Natural,Climatological,,El Nino,Guyana,"Barima Waini (region N°1), Cuyuni/mazaruni (region N°7), Pomeroon/supenaam (region N°2), Potaro/siparuni (region N°8), Upper Takutu/upper Essequibo (region N°9) provinces",5.310446169150110,-58.942901052830900,2010-01-01,2010-06-28,,,,14700.0,85.29206060000000
Storm,Tropical cyclone,Natural,Meteorological,Typhoon Chanthu,,Hong Kong,Hong Kong,22.3193039,114.1693611,2010-07-21,2010-07-23,1.0,15000.0,,,85.29206060000000
Flood,Riverine flood,Natural,Hydrological,,Heavy rains,Honduras,"Atlantida, Choluteca, Colon, Comayagua, Copan, Cortes, Francisco Morazan, Gracias A Dios, Intibuca, Islas De Bahia, La Paz, Lempira, Name Unknown, Ocotepeque, Olancho, Paraiso, Santa Barbara, Valle, Yoro provinces",20.759767433333300,-82.73292132222220,2010-08-01,2010-08-28,117.0,3400.0,,,85.29206060000000
Storm,Tropical cyclone,Natural,Meteorological,Hurricane Agatha,,Honduras,"Copan, Santa Barbara, Cortes, Yoro, Paraiso, Francisco Morazan, Choluteca, Valle, La Paz, Intibuca, Lempira, Ocotepeque, Comayagua provinces",17.794304611111100,-94.1503105222222,2010-05-29,2010-05-29,18.0,16673.0,,90000.0,85.29206060000000
Flood,Riverine flood,Natural,Hydrological,,Heavy rains,Croatia,"Slavonski Brod city (Slavonski Brod-posav province), Vinkovci city (Vukovar-srijem province)",45.20175393333330,18.27483206666670,2010-06-03,2010-06-03,,300.0,,80000.0,85.29206060000000
Flood,Riverine flood,Natural,Hydrological,,Heavy rains,Croatia,"Metkovic, Opuzen, Ploce, Kula Norinska cities (Dubrovnik-neretva province)",43.0310887,17.603429,2010-12-03,2010-12-03,,810.0,,,85.29206060000000
Extreme temperature,Cold wave,Natural,Meteorological,,,Croatia,Cakovec city (Medimurje province),46.3897383,16.4379653,2010-12-18,2010-12-28,,,,,85.29206060000000
Flood,Riverine flood,Natural,Hydrological,,Heavy rains,Haiti,"Port-au-Prince, Croix-Des-Bouquets districts (Ouest province)",18.594395,-72.3074326,2010-10-18,2010-10-18,13.0,,,,85.29206060000000
Flood,Riverine flood,Natural,Hydrological,,Heavy rains,Hungary,Borsod-Abauj-Zemplen province,48.2939401,20.6934113,2010-05-15,2010-06-07,1.0,2000.0,,440000.0,85.29206060000000
Flood,Flash flood,Natural,Hydrological,,,Indonesia,Kolaka Utara district (Sulawasi Tenggara province),-3.1347227,121.1710389,2010-01-22,2010-01-22,10.0,225.0,,,85.29206060000000
Flood,Riverine flood,Natural,Hydrological,,,Indonesia,Jawa Timur province,-7.5360639,112.2384017,2010-01-11,2010-01-11,5.0,28500.0,,,85.29206060000000
Flood,Riverine flood,Natural,Hydrological,,Heavy rains,Indonesia,Tabalong district (Kalimantan Selatan province),-1.864302,115.5681084,2010-09-11,2010-09-11,24.0,,,,85.29206060000000
Landslide,Landslide,Natural,Hydrological,,Heavy rains and human work,Indonesia,Sulawesi Tengah province,-1.4300254,121.4456179,2010-10-12,2010-10-12,13.0,,,,85.29206060000000
Storm,Convective storm,Natural,Meteorological,,,India,"Mushalpur, Baksa towns (Nalbari district, Assam province)",26.6593594,91.3408979,2010-04-10,2010-04-10,28.0,,,,85.29206060000000
Storm,Convective storm,Natural,Meteorological,,,India,"Bihar, Jharkhand provinces",24.82789565,85.2722472,2010-08-25,2010-08-25,25.0,,,,85.29206060000000
Flood,Riverine flood,Natural,Hydrological,,Heavy rains,India,Delhi province,28.7040592,77.10249020000000,2010-07-13,2010-07-13,11.0,,,,85.29206060000000
Landslide,Avalanche,Natural,Hydrological,,,India,Administrative unit not available district (Jammu and Kashmir province),33.277839,75.34121790000000,2010-02-08,2010-02-08,17.0,,,,85.29206060000000
Storm,Tropical cyclone,Natural,Meteorological,,,India,"Bihar, West Bengal, Assam provinces",24.4755998,86.56361135,2010-04-13,2010-04-14,114.0,,,,85.29206060000000
Extreme temperature,Heat wave,Natural,Meteorological,,,India,"Delhi, Haryana, Madhya Pradesh, Orissa, Rajasthan, Uttar Pradesh provinces",25.92803435,78.40518713333330,2010-03-01,2010-05-28,250.0,,,,85.29206060000000
Wildfire,Forest fire,Natural,Climatological,,,Israel,"Isfiya village (Carmel forest, Haifa province)",32.720737,35.059087,2010-12-02,2010-12-05,44.0,20000.0,,270000.0,85.29206060000000
Extreme temperature,Cold wave,Natural,Meteorological,,,Italy,"Lombardia, Piemonte, Emilia-romagna, Veneto, Roma district (Lazio province), Bolzano district (Trentino-alto Adige province)",44.9202,10.6735419,2010-12-01,2010-12-01,,,,,85.29206060000000
Flood,Riverine flood,Natural,Hydrological,,Heavy rains,Japan,"Gifu, Simane, Hirosima provinces",34.90435600000000,134.6079636,2010-07-18,2010-07-18,10.0,,,,85.29206060000000
Extreme temperature,Heat wave,Natural,Meteorological,,,Japan,"Aiti, Ehime, Gifu, Gunma, Hirosima, Hukui, Hukuoka, Hukusima, Hyoogo, Ibaraki, Isikawa, Kagawa, Kagosima, Kanagawa, Kooti, Kumamoto, Kyooto, Mie, Miyagi, Miyazaki, Nagano, Nagasaki, Nara, Niigata, Okayama, Okinawa, Ooita, Oosaka, Saga, Saitama, Siga, Simane, Sizuoka, Tiba, Tokusima, Tookyoo, Totigi, Tottori, Toyama, Wakayama, Yamagata, Yamaguti, Yamanasi provinces",34.30395215,135.62841313,2010-07-19,2010-07-25,170.0,15000.0,,,85.29206060000000
Flood,Riverine flood,Natural,Hydrological,,,Kazakhstan,"Tarbagatay, Abay, Kurshum, Zaysan, Ulan districts (Vostochno-kazachstanskaya province)",48.27694903333330,83.6370585,2010-03-17,2010-03-24,,8000.0,,,85.29206060000000
Landslide,Landslide,Natural,Hydrological,,Torrential rain,Kenya,"Kitony village (Marakwet district, Rift Valley province)",,,2010-04-30,2010-04-30,10.0,,,,85.29206060000000
Landslide,Landslide,Natural,Hydrological,,Heavy rains,Kyrgyzstan,"Suzak, Bazar-Korgon districts (Jalal-Abad province), Kara-Kulja, Ozgon, Kara-Suu districts (Osh province)",40.69054256666670,73.09834143333330,2010-06-03,2010-06-03,,8350.0,,,85.29206060000000
Flood,Riverine flood,Natural,Hydrological,,Heavy rains,Cambodia,"Banteay Meanchey, Battambang, Otdar Meanchey, Pailin, Preah Vihear, Pursat provinces",13.49673146,103.75002168,2010-10-20,2010-11-09,8.0,,,70000.0,85.29206060000000
Storm,Tropical cyclone,Natural,Meteorological,Typhoon Kompasu,,Korea (the Republic of),"Chungchongnam-do, Chollanam-do, Kwangju, Inchon, Seoul provinces",35.984198075,126.73697615,2010-09-02,2010-09-02,12.0,41500.0,,,85.29206060000000
Flood,Flash flood,Natural,Hydrological,,,Saint Lucia,Region Number 3 province,,,2010-10-06,2010-10-06,,2000.0,,,85.29206060000000
Extreme temperature,Cold wave,Natural,Meteorological,,,Lithuania,"Alytaus, Kauno, Klaipedos, Marijampoles, Panevezio, Siauliu, Taurages, Telsiu, Utenos, Vilniaus provinces",55.26439135,23.55580501,2010-11-27,2010-12-01,5.0,,,,85.29206060000000
Storm,Extra-tropical storm,Natural,Meteorological,Xynthia,,Luxembourg,"Diekirch, Grevenmacher, Luxembourg province",49.867569333333300,6.022673633333330,2010-02-28,2010-02-28,,,,31000.0,85.29206060000000
Landslide,Landslide,Natural,Hydrological,,Heavy rains,Mexico,Villa Guerrero district (Mexico province),18.9631066,-99.636919,2010-09-21,2010-09-21,27.0,,,,85.29206060000000
Landslide,Landslide,Natural,Hydrological,,Heavy rains,Mexico,"Santa Maria Tlahuitoltepec municipality (Mixe district, Oaxaca province) ; Oaxaca, Chiapas provinces",16.9430538,-94.5879891,2010-09-28,2010-09-29,44.0,,,,85.29206060000000
Flood,Riverine flood,Natural,Hydrological,,Heavy rains,Mali,Tombouctou district (Tombouctou province),16.7665887,-3.0025615,2010-08-11,2010-08-12,,16000.0,,,85.29206060000000
Flood,Riverine flood,Natural,Hydrological,,Heavy rains,Mali,"Kayes, Koulikoro, Segou, Sikasso, Mopti, Tombouctou, Gao, Kidal, Bamako provinces",14.505159014285700,-5.311761814285710,2010-10-04,2010-10-04,,16000.0,,,85.29206060000000
Flood,Riverine flood,Natural,Hydrological,,,Malawi,Dedza district (Central Region province),-14.1894585,34.2421597,2010-03-22,2010-03-22,,21290.0,,,85.29206060000000
Flood,Riverine flood,Natural,Hydrological,,Heavy rains,Niger (the),"Zinder, Maradi provinces",13.65139515,8.0444548,2010-07-19,2010-07-23,2.0,,,,85.29206060000000
Flood,Riverine flood,Natural,Hydrological,,"Intermittent rain, tropical depression Agatha",Nicaragua,"Chinandega, Corinto, Chichigalpa districts (Chinandega province), Leon, Managua provinces",19.9324297,-66.58581625,2010-05-26,2010-06-03,,4860.0,,,85.29206060000000
Flood,Riverine flood,Natural,Hydrological,,,Nicaragua,"Atlantico Norte, Managua, Granada, Jinotega, Esteli, Chinandega provinces",12.56927532,-86.33638392,2010-08-17,2010-09-16,66.0,71000.0,,,85.29206060000000
Storm,Tropical cyclone,Natural,Meteorological,"Tropical storm ""Alex""",,Nicaragua,Atlantico Norte province,44.0144936,6.2116438,2010-06-27,2010-06-27,5.0,,,,85.29206060000000
Storm,Tropical cyclone,Natural,Meteorological,Tropical storm Matthew,,Nicaragua,"Atlantico Norte, Atlantico Sur, Boaco, Carazo, Chinandega, Chontales, Esteli, Granada, Jinotega, Leon, Madriz, Managua, Masaya, Matagalpa, Nueva Segovia, Rio San Juan, Rivas provinces",18.25502911,-69.70502022,2010-09-24,2010-09-24,,,,,85.29206060000000
Storm,Extra-tropical storm,Natural,Meteorological,Xynthia,,Netherlands (the),"Drenthe, Flevoland, Friesland, Gelderland, Groningen, Limburg, Noord-brabant, Noord-holland, Overijssel, Utrecht, Zeeland, Zuid-holland provinces",52.28483778,5.69753454,2010-02-28,2010-02-28,,,,28000.0,85.29206060000000
Storm,Tropical cyclone,Natural,Meteorological,"Cyclone ""Phet""",,Oman,"A Dakhliya, A Sharqiya, Al Batnah, Al Dhahira, Al Wusta, Dhofar, Musandam, Muscat provinces",22.1418347,56.5128921,2010-06-06,2010-06-06,16.0,,,1000000.0,85.29206060000000
Flood,Flash flood,Natural,Hydrological,,Monsoonal rain,Pakistan,"Barkhan, Bolan, Kohlu, Nasirabad, Sibi districts (Balochistan province), Mohmand Agency, Khyber Agency (Federally Administered Tribal Areas), Bannu, Batagram, Charsadda, D. I. Khan, Kohat, Kohistan, Lakki Marwat, Lower Dir, Mansehra, Nowshera, Peshawar, Shangla, Swat, Tank districts (North-West Frontier province), Khushab, Layyah, Mianwali, Muzaffargarh, Rajanpur districts (Punjab province), Bagh, Gilgit-Baltistan, Mirpur, Muzaffarabad districts (Jammu and Kashmir province), Sindh province",32.58636668,70.80154528,2010-07-28,2010-08-07,1985.0,20356550.0,,9500000.0,85.29206060000000
Landslide,Avalanche,Natural,Hydrological,,,Pakistan,"Saidan Gutlo, Mula Khail Gutlo, Gujri Bek, Kachar, Seri, Gutlo Bawon, Pari Mula Khail, Bawon Soya Khail, Karon Mula Khail, Haran, Atta Abad, Kundian villages (Kohistan District district, North-West Frontier province)",34.607686566666700,73.04823263333330,2010-02-18,2010-02-18,31.0,3633.0,,,85.29206060000000
Landslide,Landslide,Natural,Hydrological,,Heavy snowfall,Pakistan,Administrative unit not available district (Jammu and Kashmir province),33.277839,75.34121790000000,2010-01-04,2010-01-04,19.0,26700.0,,18000.0,85.29206060000000
Landslide,Landslide,Natural,Hydrological,,Heavy rains,Peru,"Ancash, Cajamarca provinces ; Huanuco, Ambo districts (Huanuco province), Trujillo district (La Libertad province)",-9.06416775,-77.2799959,2010-04-01,2010-04-06,68.0,,,,85.29206060000000
Extreme temperature,Cold wave,Natural,Meteorological,,,Peru,"Ancash, Apurimac, Arequipa, Ayacucho, Cusco, Huanvelica, Huanuco, Junin, Lima, Moquegua, Pasco, Puno, Tacna, Madre de Dios, Ucayali, Loreto provinces",-12.43263533,-74.45252120000000,2010-07-01,2011-01-28,409.0,57600.0,,,85.29206060000000
Flood,Flash flood,Natural,Hydrological,,,Philippines (the),"Brgys Putik, Tugbungan, Boalan barangays villages (Zamboanga City area, Zamboanga Del Sur district, Region IX province)",7.00730942,122.14017334,2010-08-15,2010-08-15,,505.0,,,85.29206060000000
Flood,Riverine flood,Natural,Hydrological,,Heavy rains,Philippines (the),"Naujan, Baco areas (Mindoro Oriental district, Region IV province)",13.2827925,121.0564425,2010-01-17,2010-01-17,1.0,15480.0,,,85.29206060000000
Flood,Riverine flood,Natural,Hydrological,,Heavy rains,Philippines (the),"Sultan Kudarat district (Region XII province), Shariff Kabunsuan, Maguindanao districts (ARMM province)",7.11880865,124.5354571,2010-06-01,2010-06-01,,200000.0,,,85.29206060000000
Flood,Riverine flood,Natural,Hydrological,,Moderate and heavy rain,Philippines (the),"Sultan Kudarat, Pagalundan, Datu Montawal areas (Maguindanao district, ARMM province), Lambayong area (Sultan Kudarat district, Region XII province), Kabacan area (North Cotabato district, Region XII province)",6.956251700000000,124.69686385,2010-07-13,2010-07-31,,80920.0,,,85.29206060000000
Landslide,Landslide,Natural,Hydrological,,Continuous heavy rains,Philippines (the),"Cagdiana area (Dinagat district, Region XIII (Caraga) province)",9.9688109,125.5986093,2010-01-01,2010-01-01,2.0,925.0,,78.0,85.29206060000000
Storm,Tropical cyclone,Natural,Meteorological,Typhoon Megi (Juan),,Philippines (the),"Aringuay, Bangar areas (La Union district, Region I (Ilocos region) province), Bolinao areas (Pangasinan district, Region I (Ilocos region) province), Aparri, Claveria, Gonzaga, Iguig, Lasam, Rizal, Santa Aba, Santa Praxedes, Santa Teresita, Santo Nino, Tiao areas (Cagayan district, Region II (Cagayan Valley) province), Dinapigue, Divilacan, San Mariano, Santa Maria (Isabela district, Region II (Cagayan Valley) province), Casiguran, Dilasag, Dinalungan areas (Aurora district, Region III (Central Luzon) province), Bagio City, Itogon, La Trinidad, Tublay areas (Benguet district, Cordillera Administrative region (CAR) province), Pinukbuk, Tabuk areas (Kalinga district, Cordillera Administrative region (CAR) province), Tadian area (Mountain Province district, Cordillera Administrative region (CAR) province)",16.103689475,121.2783686625,2010-10-18,2010-10-18,35.0,2008984.0,,275745.0,85.29206060000000
Extreme temperature,Cold wave,Natural,Meteorological,,,Poland,"Dolnoslaskie, Kujawsko-Pomorskie, Lodzkie, Lubeiskie, Lubuskie, Malopolske, Mazowieckie, Opolskie, Podkarpackie, Podlaskie, Pomorskie, Slaskie, Swietokrzyskie, Warminsko-Mazurskie, Wielkopolskie, Zachodnio-Pomorskie provinces",51.66173291,19.28934074,2010-11-01,2011-02-28,200.0,,,,85.29206060000000
Storm,Extra-tropical storm,Natural,Meteorological,Xynthia,,Portugal,"Paredes, Porto, Vila Nova de Gaia districts (Porto province)",41.155549066666700,-8.560028333333330,2010-02-27,2010-02-27,3.0,,,270000.0,85.29206060000000
Extreme temperature,Cold wave,Natural,Meteorological,,,Portugal,"Aveiro, Beja, Braga, Braganca, Castelo Branco, Coimbra, Evora, Faro, Guarda, Leiria, Lisboa, Portalegre, Porto, Santarem, Setubal, Viana Do Castelo, Vila Real, Viseu provinces",39.92601291,-8.07392327,2010-12-01,2010-12-28,,,,,85.29206060000000
Extreme temperature,Cold wave,Natural,Meteorological,,,Paraguay,"Alto Paraguay, Alto Parana, Amambay, Boqueron, Caaguazu, Caazapa, Canindeyu, Central, Concepcion, Cordillera, Guaira, Itapua, Misiones, Neembucu, Paraguari, Presidente Hayes, San Pedro provinces",-24.71658165,-56.72707194,2010-07-01,2010-07-28,12.0,,,,85.29206060000000
Flood,Riverine flood,Natural,Hydrological,,Heavy rains,"Palestine, State of",Khan Yunis province,31.3462005,34.3039986,2010-01-18,2010-01-19,,,,,85.29206060000000
Flood,Riverine flood,Natural,Hydrological,,Heavy rains,Romania,"Botosani, Alba, Bacau, Iasi, Vrancea, Caras-Severin, Tulcea, Braila, Covasna, Ialomita, Mures, Hargita, Neamt, Cluj, Bihor, Suceava province",46.48849287,26.01871092,2010-06-21,2010-07-03,26.0,12237.0,,1111428.0,85.29206060000000
Extreme temperature,Cold wave,Natural,Meteorological,,,Romania,"Bucuresti, Alba, Arges, Bacau, Bistrita-nasaud, Satu Mare, Prahova, Botosani provinces",46.278027,25.424286242857100,2010-01-22,2010-01-26,52.0,,,,85.29206060000000
Flood,Riverine flood,Natural,Hydrological,,Sharp increase in temperatures triggering melting snow,Russian Federation (the),"Kividensky, Novoannensky, Olholvsky, Rudnyansky, Staropoltavsky, Kamishinsky distrcits (Volgogradskaya Oblast province)",50.63194690000000,45.5275412,2010-03-22,2010-03-26,,3250.0,,,85.29206060000000
Flood,Riverine flood,Natural,Hydrological,,Torrential rains,Russian Federation (the),"Tuapsinskoye, Dzhubskoye, Novomichailovskoye cities, Velyaminivskoye, Georgievskoye, Shaumyanskoye, Shepsinskoye, Octyabrskoye, Tenginskoye villages (Tuapsinky area), Urinskoye village (Apsheronsky area) (Krasnodarskiy Kray province)",44.2844172,39.6855544,2010-10-16,2010-10-16,23.0,45214.0,,66000.0,85.29206060000000
Extreme temperature,Cold wave,Natural,Meteorological,,,Russian Federation (the),"Moskva, Moskovskaya Oblast, Sankt-peterburg, Leningradskaya Oblast, Orlovskaya Oblast, Chuvashiya Rep. provinces",56.73920316,36.87958544,2010-01-01,2010-01-26,13.0,,,,85.29206060000000
Extreme temperature,Cold wave,Natural,Meteorological,,,Russian Federation (the),Moskva province,55.755826,37.6173,2010-12-03,2010-12-03,11.0,,,,85.29206060000000
Extreme temperature,Heat wave,Natural,Meteorological,,,Russian Federation (the),"Moska, Moskovskaya Oblast, Volgogradskaya Oblast, Lipetskaya Oblast, Voronezhskaya Oblast provinces",52.121572425,40.589857375,2010-06-01,2010-08-28,55736.0,,,400000.0,85.29206060000000
Wildfire,Forest fire,Natural,Climatological,,,Russian Federation (the),Volgogradskaya Oblast region,49.7604522,45.0,2010-09-02,2010-09-03,8.0,,,,85.29206060000000
Landslide,Landslide,Natural,Hydrological,,Heavy rains,Rwanda,"Murambi, Kubukoko, Knebwe areas (Rubavu district, West/Iburengerazuba province)",-1.6479132,29.3482646,2010-03-26,2010-03-31,14.0,,,,85.29206060000000
Landslide,Landslide,Natural,Hydrological,,,Rwanda,Nyabihu district (West/Iburengerazuba province),-1.6955422,29.5571677,2010-05-16,2010-05-16,7.0,,,,85.29206060000000
Flood,Riverine flood,Natural,Hydrological,,,Sudan (the),"Nile, Gadaref, White Nile, Northern Kordofan, Sennar provinces",13.795888,34.4678862,2010-07-01,2010-10-07,3.0,16350.0,,,85.29206060000000
Flood,Riverine flood,Natural,Hydrological,,Heavy rains,Senegal,Kolda district (Kolda province),21.670668,71.0713009,2010-08-12,2010-08-23,2.0,22116.0,,,85.29206060000000
Flood,Riverine flood,Natural,Hydrological,,Heavy rains,Senegal,Saint louis district (Saint louis province),,,2010-10-17,2010-10-18,,80337.0,,,85.29206060000000
Flood,Riverine flood,Natural,Hydrological,,Tropical Depression,Solomon Islands,"Guadalcanal, Isabel, Makira, Malaita Islands areas",-9.2609726,160.52635205,2010-01-21,2010-02-09,2.0,16016.0,,,85.29206060000000
Flood,Riverine flood,Natural,Hydrological,,,Sierra Leone,"Kailahun, Kono districts (Eastern province), Kambia, Tonkolili districts (Northern province), Western Area Urb district (Western Area province), Southern province",8.77795008,-12.10463038,2010-08-01,2010-08-28,,234.0,,,85.29206060000000
Landslide,Landslide,Natural,Hydrological,,,Sierra Leone,Western Area Urb district (Western province),8.4545561,-13.2432632,2010-08-09,2010-08-09,16.0,,,,85.29206060000000
Storm,Tropical cyclone,Natural,Meteorological,Tropical storm Matthew,,El Salvador,"Ahuachapan, Cabanas, Chalatenango, Cuscatlan, La Libertad, La Paz, La Union, Morazan, San Miguel, San Salvador, San Vicente, Santa Ana, Sonsonate, Usulutan provinces",10.70900901,-86.89435972,2010-09-25,2010-09-25,1.0,,,,85.29206060000000
Flood,Riverine flood,Natural,Hydrological,,Heavy rains,Somalia,"Awdal, Sanaag, Sool, Togdheer, Woqooyi Galbeed provinces",9.794084833333330,45.7197246,2010-04-24,2010-04-24,11.0,,,,85.29206060000000
Flood,Riverine flood,Natural,Hydrological,,,Slovakia,"Presov, Zilna provinces",49.0018324,21.2393119,2010-05-15,2010-05-26,1.0,200.0,,25000.0,85.29206060000000
Flood,Riverine flood,Natural,Hydrological,,Heavy rains,Slovakia,"Svidnik district, Presov province",49.3445834,21.5766802,2010-06-01,2010-06-02,3.0,650.0,,,85.29206060000000
Extreme temperature,Cold wave,Natural,Meteorological,,,Slovakia,"Banska Bystrica, Bratislava, Kosice, Nitra, Presov, Trencin, Trnava, Zilna provinces",48.71623125714290,19.08643184285710,2010-11-01,2011-02-28,122.0,,,,85.29206060000000
Flood,Riverine flood,Natural,Hydrological,,,Togo,"Centrale, Kara, Maritime, Plateaux, Savanes provinces",9.5486112,1.1977158,2010-06-05,2010-10-28,21.0,82000.0,,,85.29206060000000
Flood,Riverine flood,Natural,Hydrological,,Heavy rains,Togo,"Baguida, Kagome, Adakpame, Djidjole, Agbalepedo, Agoe boroughs (Lome City, Golfe district, Maritime province), Yoto, Golfe, Lacs districts (Martitime province)",11.95709136,28.1436483,2010-09-01,2010-10-28,1.0,29550.0,,,85.29206060000000
Drought,Drought,Natural,Climatological,,,Thailand,"Ang Thong, Chainat, Chaiyaphum, Chiang Rai, Kalasin, Kampaeng Phet, Khon Kaen, Lampang, Loei, Lopburi, Maha Sarakham, Mukdahan, Nakhon Phanom, Nakhon Ratchasima, Nakhon Sawan, Nan, Nong Bua Lamphu, Nong Khai, Phayao, Phichit, Phitsanulok, Phra Nakhon Si Ayudhya, Phrae, Sakon Nakhon, Saraburi, Singburi, Sukhothai, Suphanburi, Udon Thani, Uthai Thani, Uttaradit provinces",17.01572944,101.18809908,2010-03-01,2011-03-28,,6482602.0,,,85.29206060000000
Flood,Riverine flood,Natural,Hydrological,,Heavy rains,Tajikistan,"Voseysky, Shurabad, Muminobod, Bokhtar, Kulyab districts (Khatlon province), Ura-Tubinskiy district (Sogd province), Faysabadskiy, Varzob districts (Tadzhikistan Territories province)",40.84371101666670,67.4629257,2010-04-11,2010-04-11,2.0,1914.0,,,85.29206060000000
Landslide,Landslide,Natural,Hydrological,,Torrential rains,Turkey,"Gundogdu village (Merkez district, Rize province)",41.08735,41.09696,2010-08-27,2010-08-27,13.0,,,,85.29206060000000
Landslide,Landslide,Natural,Hydrological,,Heavy rains,Uganda,"Himumtu, Mazimasa, Kachonga, Butalega Rural, Butaleja Town areas (Bunyole district, Butaleja province), Nametsi, Kubehwo, Namangasa, Namasheti, Bumayoka villages (Manjiya district, Bududa province), Amudat, Amuria, Budaka, Bukwo, Kapchorwa, Katakwi, Kibuku, Manafwa, Mbale, Moroto, Nakapiripirit, Napak, Pallisa, Sironko provinces",1.48035338,34.28774437,2010-02-25,2010-03-01,388.0,12785.0,,,85.29206060000000
Extreme temperature,Cold wave,Natural,Meteorological,,,Uruguay,"Artigas, Canelones, Cerro Largo, Colonia, Durazno, Flores, Florida, Lavalleja, Maldonado, Montevideo, Paysandu, Rio Negro, Rivera, Rocha, Salto, San Jose, Soriano, Tacuarembo, Treinta Y Tres provinces",-33.54666502,-56.46585627,2010-07-01,2010-07-28,4.0,,,,85.29206060000000
Storm,Convective storm,Natural,Meteorological,,,United States of America (the),"Yazoo district (Mississippi province), Alabama, Louisiana, Arkansas, Georgia, Tennessee provinces",32.679452966666700,-90.08499793333330,2010-04-24,2010-04-24,12.0,2700.0,,,85.29206060000000
Storm,Convective storm,Natural,Meteorological,,,United States of America (the),"Arkansas, Missouri, Illinois provinces",37.932809266666700,-91.0207317,2010-12-31,2011-01-01,8.0,,,,85.29206060000000
Storm,Convective storm,Natural,Meteorological,,,United States of America (the),"New Jersey, Pennsylvania, Maryland, North Carolina, Delaware, District of Columbia, Virginia provinces",38.75951022857140,-76.92602737142860,2010-02-05,2010-02-11,2.0,,,2000000.0,85.29206060000000
Storm,Convective storm,Natural,Meteorological,,,United States of America (the),"New York, District of Columbia, New Jersey, Pennsylvania, New Hampshire, Massachusetts, Maine, Connecticut, Rhode Island, Vermont provinces",42.38708125,-72.93674125,2010-02-23,2010-02-28,1.0,,,500000.0,85.29206060000000
Storm,Convective storm,Natural,Meteorological,,,United States of America (the),"Boston city (Suffolk district, Massachusetts province), Philadelphia district (Pennsylvania province), Fulton, DeKalb, Cobb, Clayton, Gwinnett districts (Georgia province), New York, North Carolina, Delaware, Maryland, Rhode Island, Virginia provinces",38.63822584,-77.34359056,2010-12-26,2010-12-26,,,,,85.29206060000000
Storm,Tropical cyclone,Natural,Meteorological,"Tropical storm ""Beatrix""",,Mexico,"Guerrero, Colima, Jalisco, Michoacan, Oaxaca provinces",18.54180253333330,-100.2947871,2011-06-20,2011-06-20,3.0,450.0,,,87.98460292
Storm,Tropical cyclone,Natural,Meteorological,Hurricane Jova,,Mexico,"Puerto Vallarta district (Jalisco province), Manzanillo district (Colima province), Michoacan, Nayarit provinces",18.1449789,-100.25667634,2011-10-10,2011-11-01,5.0,50000.0,,27700.0,87.98460292
Storm,Tropical cyclone,Natural,Meteorological,Typhoon Bebeng (Aere),,Philippines (the),"Bulacan, Zambales districts (Region III (Central Luzon) province), Cebu district (Region VII (Central Visayas) province), Eastern Samar, Leyte, Northern Samar, Samar districts (Region VIII (Eastern Visayas) province), National Capital region (NCR), Region V (Bicol region)",15.5289633,115.30591526666700,2011-05-08,2011-05-11,37.0,430081.0,,31259.0,87.98460292
Storm,Tropical cyclone,Natural,Meteorological,"Tropical storm ""Dodong"" (Sarika)",,Philippines (the),"National Capital region (NCR), Region III (Central Luzon), Region IV (Southern Tagalog), Region IV-A (Calabarzon) provinces",14.730868733333300,120.93787643333300,2011-06-09,2011-06-10,9.0,1151.0,,,87.98460292
Storm,Tropical cyclone,Natural,Meteorological,"Topical storm ""Meari"" (Falcon)",,Philippines (the),"Pangasinan district (Region I (Ilocos region) province), Batangas, Cavite, Rizal districts (Region IV-A (Calabarzon) province), Albay, Camarines Sur districts (Region V (Bicol region) province, National Capital region (NCR), Region III (Central Luzon) provinces",14.37192397,121.41706458,2011-06-21,2011-06-25,20.0,1700085.0,,12869.0,87.98460292
